{
  "files": [
    {
      "path": "versions.tf",
      "content": "terraform {\n  required_version = \">= 1.5.0\"\n\n  required_providers {\n    huaweicloud = {\n      source  = \"huaweicloud/huaweicloud\"\n      version = \"~> 1.93\"\n    }\n  }\n}\n"
    },
    {
      "path": "provider.tf",
      "content": "provider \"huaweicloud\" {\n  region = var.region\n}\n"
    },
    {
      "path": "variables.tf",
      "content": "variable \"region\" {\n  type        = string\n  description = \"Huawei Cloud region\"\n}\n\nvariable \"vpc_name\" {\n  type = string\n}\n\nvariable \"vpc_cidr\" {\n  type = string\n}\n\nvariable \"rds_password\" {\n  type      = string\n  sensitive = true\n}\n"
    },
    {
      "path": "network.tf",
      "content": "resource \"huaweicloud_vpc\" \"main\" {\n  name = var.vpc_name\n  cidr = var.vpc_cidr\n}\n"
    },
    {
      "path": "terraform.tfvars.example",
      "content": "region   = \"me-east-1\"\nvpc_name = \"demo-vpc\"\nvpc_cidr = \"10.10.0.0/16\"\n"
    },
    {
      "path": "README.md",
      "content": "# Generated Huawei Cloud Terraform\n\nReview provider fields, set secrets using environment variables, then run validate and plan.\n"
    }
  ],
  "missing_fields": [],
  "assumptions": [
    "This example intentionally keeps resources minimal for writer and policy-check testing."
  ],
  "risk_notes": []
}
